{
  "sample_id": "DFSTD-V-000001",
  "group_id": "GRP-000001",
  "parent_sample_id": null,
  "source_id": "SRC-GEN-000001",
  "file_path": "media/fake/DFSTD-V-000001.mp4",
  "sha256": "aaaaaaaaaaaaaaaaaaaaaaaaaaaaaaaaaaaaaaaaaaaaaaaaaaaaaaaaaaaaaaaa",
  "source_type": "SRC-GEN",
  "media_type": "video",
  "label_state": "FAKE",
  "fake_modalities": ["M2"],
  "fake_objects": ["O1"],
  "fake_method": "controlled_example",
  "method_family": "identity_replacement",
  "scope_id": "face.full.segment",
  "granularity": "object",
  "duration_sec": 3.2,
  "width": 1920,
  "height": 1080,
  "fps": 25.0,
  "partition": "D0",
  "license_status": "standard_internal",
  "access_class": "internal",
  "annotation_version": "1.0.0",
  "review_status": "adjudicated",
  "exclusion_status": "included",
  "exclusion_reason": null,
  "schema_version": "1.0.0"
}
